product_title,average_rating,total_reviews,review_author,review_rating,review_text
"Apple iPhone 7, 32GB, Black - Fully Unlocked (Renewed)",4.2,9848,Cristina Rojas,1,"The most terrible and worst decision ever made was to purchase a phone from this seller. They sell models of the phone which eventually fail because of antena issues. It just constantly says ‚Äúsearching‚Äù or ‚Äúno service‚Äù when there clearly is service. I didn‚Äôt know that this specific model was actually a recalled model back when they initially released the phone. I do not recommend buying from a seller who sells recalled items. I contacted them and they couldn‚Äôt do anything about it. This was their reply. ‚Äú I am sorry this has happed, however, the item is no longer covered under warranty.‚Äù At least learn how to type correctly. Such a rip off. I would give no stars if possible."
"Apple iPhone 7, 32GB, Black - Fully Unlocked (Renewed)",4.2,9848,Renny,5,Love this phone it didn‚Äôt come with a scratch whatsoever thank you Amazon!!!
"Apple iPhone 7, 32GB, Black - Fully Unlocked (Renewed)",4.2,9848,Amazon Customer,5,Defiantly worth it would for sure buy again
"Apple iPhone 7, 32GB, Black - Fully Unlocked (Renewed)",4.2,9848,Marisela garcia,1,No compren eso n sirve son usados
"Apple iPhone 7, 32GB, Black - Fully Unlocked (Renewed)",4.2,9848,Luis P.,5,"Great phone , love it"
"Apple iPhone 7, 32GB, Black - Fully Unlocked (Renewed)",4.2,9848,LeRoy C. Ullrich,5,This phone worked exactly as was supposed to and that I expected. Very happy with it. Phone was in good shape and looked like new.
"Apple iPhone 7, 32GB, Black - Fully Unlocked (Renewed)",4.2,9848,Nikki Crosby,5,Phone came perfect! Unlocked and works great. Battery life sucks ngl but totally worth the cost üôåüèªüëåüèªüòÅ
"Apple iPhone 7, 32GB, Black - Fully Unlocked (Renewed)",4.2,9848,JJLZ,1,Horrible battery. At 100% at 7am.. and by 11 am is at 20%. Would never buy again. Nor do I recommend.
"Apple iPhone 7, 32GB, Black - Fully Unlocked (Renewed)",4.2,9848,Lisa,1,Don‚Äôt buy from Kanga Supply!! I bought this phone under a year ago. Phone has a factory defect and won‚Äôt work. So convenient that it happened when the return period is over. Because I‚Äôm not the original purchaser Apple won‚Äôt fix. Not a bit happy. Not sure I‚Äôd risk purchasing this if I were you.
"Apple iPhone 7, 32GB, Black - Fully Unlocked (Renewed)",4.2,9848,Peter B. Straub,4,Replacing a lost phone quick easy and cheap.
"Apple iPhone 7, 32GB, Black - Fully Unlocked (Renewed)",4.2,9848,Buyer,5,After ordering the same phone from some miserable outfit that sent me three different phones all below battery capacity it was a pleasure dealing through Amazon and receiving a no hassle perfect phone. Thank you
"Apple iPhone 7, 32GB, Black - Fully Unlocked (Renewed)",4.2,9848,Aamal,5,Fully unlocked
"Apple iPhone 7, 32GB, Black - Fully Unlocked (Renewed)",4.2,9848,michael jared,1,"I was never able to activate it, because the software was so far outdated. I would have had to take it to an apple store."
"Apple iPhone 7, 32GB, Black - Fully Unlocked (Renewed)",4.2,9848,Charles Wells,4,Phone in good shape except battery needs to be replaced cause iPhone is telling us so. Didn‚Äôt plan on that or I‚Äôd bought a new one. Other than that in good shape.
"Apple iPhone 7, 32GB, Black - Fully Unlocked (Renewed)",4.2,9848,AgonFaz,3,It arrived late and thats why I am giving it 3 stars. The iPhone it self arrived in a great condition.
"Apple iPhone 7, 32GB, Black - Fully Unlocked (Renewed)",4.2,9848,Happy customer,5,"Works as expected, thanks. I just wish I could retrieve all my pictures from my old phone"
"Apple iPhone 7, 32GB, Black - Fully Unlocked (Renewed)",4.2,9848,Kathleen Opinski,1,Touch screen impossible!!! Certain keys won't type It freezes up I'm about to return it!!
"Apple iPhone 7, 32GB, Black - Fully Unlocked (Renewed)",4.2,9848,Angela,5,It was a replacement phone. The other one got busted.
"Apple iPhone 7, 32GB, Black - Fully Unlocked (Renewed)",4.2,9848,The one,4,The phone gets hot when using and the battery does not last long but it charges quickly
"Apple iPhone 7, 32GB, Black - Fully Unlocked (Renewed)",4.2,9848,Craig L. Kelley,1,"The iPhone 7 (renewed) sold and shipped to us was broken, unusable; it couldn't do the necessary iOS update; couldn't operate as a cell phone properly; couldn't, wouldn't connect to WIFI, home LAN, or my Verizon carrier. Apple offered to replace it for +$750. It should have never been sold and shipped to us. Generally speaking, it sucked."
"Apple iPhone 7, 32GB, Black - Fully Unlocked (Renewed)",4.2,9848,L.Grossberg,2,"If I were not rather desperate for the phone, I would return it. The battery status app tells me the battery needs to be serviced, whiich basically means replaced. I expected better. I would advise against ordering here."
"Apple iPhone 7, 32GB, Black - Fully Unlocked (Renewed)",4.2,9848,Heather B.,1,Was not unlocked for our phone carrier.
"Apple iPhone 7, 32GB, Black - Fully Unlocked (Renewed)",4.2,9848,samantha,5,its really good i have had it 3 weeks now it works great
"Apple iPhone 7, 32GB, Black - Fully Unlocked (Renewed)",4.2,9848,Roberto Villalpando,5,El equipo se encuentra en perfecto estado y funcionando
"Apple iPhone 7, 32GB, Black - Fully Unlocked (Renewed)",4.2,9848,Amazon Customer,3,i'm using this iPhone 7 for 8 days it's working fine but the battery is already at 74% i don't know how long this battery! I saw in the product description said it came with 80% Would this be normal?
"Apple iPhone 7, 32GB, Black - Fully Unlocked (Renewed)",4.2,9848,Michael Simpson,1,When we got the phone right from out of the box the charging port is not working properly so that is also the headphone jack in one. We basically can‚Äôt use it until I get the charge jack replaced.
"Apple iPhone 7, 32GB, Black - Fully Unlocked (Renewed)",4.2,9848,SuperDad1000,5,basically like a new phone. Everything seems perfect. on first boot it goes to the system reset/hello screen. would recommend
"Apple iPhone 7, 32GB, Black - Fully Unlocked (Renewed)",4.2,9848,liuber garcia,1,Battery die in no time it may be bad that is whit no use at all
"Apple iPhone 7, 32GB, Black - Fully Unlocked (Renewed)",4.2,9848,Ahmed Gahelrasoul,4,"Battery life is good, touch screen works fine and camera quality not bad"
"Apple iPhone 7, 32GB, Black - Fully Unlocked (Renewed)",4.2,9848,derek harris,1,The phone arrives with a bad battery in it I called the company and they‚Äôre clearly able to tell me from the serial number that they knew it had a bad battery so why was it sent to me in the first place?!?! their solution to this is for me to pay all of this money to get the problem solved and fixed ridiculous company don‚Äôt even waste given them your money just buy a product new or go elsewhere
"Apple iPhone 7, 32GB, Black - Fully Unlocked (Renewed)",4.2,9848,Jeanine Mcclamy,1,Stopped working after 1 month a waste of 200 dollars.
"Apple iPhone 7, 32GB, Black - Fully Unlocked (Renewed)",4.2,9848,Liz,1,"The phone so many scratches on it, and it looks old. Would not recommend üòè"
"Apple iPhone 7, 32GB, Black - Fully Unlocked (Renewed)",4.2,9848,simon myers,3,Check the battery after you change it
"Apple iPhone 7, 32GB, Black - Fully Unlocked (Renewed)",4.2,9848,julian,5,"Passed in everything I‚Äôve tested so far, good camera, battery 86% capacity, speaker working, is gsm unlocked. So far I‚Äôm happy with it and will update if that changes but so far it‚Äôs good."
"Apple iPhone 7, 32GB, Black - Fully Unlocked (Renewed)",4.2,9848,Bishnu phayal,5,Very nice
"Apple iPhone 7, 32GB, Black - Fully Unlocked (Renewed)",4.2,9848,Kimberly Davis,1,I really wanted to live this phone snd I was SO excited to receive it. When I powered it on it was charged to 90%. I started setting it up and it got REALLY hot really fast. Within 30 minutes it had dropped from 90% to 56%. The more I used it I noticed the touch screen is super unresponsive also. In the 11 hours I have had this phone I had had to charge it 3 time and it just will not hold a charge.
"Apple iPhone 7, 32GB, Black - Fully Unlocked (Renewed)",4.2,9848,Arowan10,5,This product works like its brand new. There are a lot of bad reviews for some reason i really don't know. For me this phone acts like i just bought it from Apple. I'm very thankful i didn't get scammed lmao
"Apple iPhone 7, 32GB, Black - Fully Unlocked (Renewed)",4.2,9848,Tamara T. Frey,1,"This was scam. everything looked good at first. We got an iphone 7 128gb and compatible with verizon. However, It was not compatible with verizon at all. Now i am hoping to get a refund. I do't think they will give it to me though. So please save yourself the trouble and shop elsewhere."
"Apple iPhone 7, 32GB, Black - Fully Unlocked (Renewed)",4.2,9848,Charika Ross,1,The phone screen has a line down it like it has water or something in it. The buttons don‚Äôt work have the time. Taking it to apple to see exactly what‚Äôs wrong with the screen
"Apple iPhone 7, 32GB, Black - Fully Unlocked (Renewed)",4.2,9848,Ary,5,Best deal we found. Works as well as an old iPhone can.
"Apple iPhone 7, 32GB, Black - Fully Unlocked (Renewed)",4.2,9848,Carlos daniel romero carbajal,5,Bateria al 92 estdo del telefono tiene golpes
"Apple iPhone 7, 32GB, Black - Fully Unlocked (Renewed)",4.2,9848,Red,3,Definitely has some problems‚Ä¶especially with the mic.
"Apple iPhone 7, 32GB, Black - Fully Unlocked (Renewed)",4.2,9848,Alexis,4,It was what I expected. The phone was for my son as a gift. He had no complaint.
"Apple iPhone 7, 32GB, Black - Fully Unlocked (Renewed)",4.2,9848,Cesar G Cardona,5,Great buy. Like new when we received it. My daughter loves it.
"Apple iPhone 7, 32GB, Black - Fully Unlocked (Renewed)",4.2,9848,YULIYA PANFILOVA,1,"I do not advise!! less than a year of using the phone, the modem broke ... no network !! used carefully, did not fall. now just change your phone! cheating !!!!"
"Apple iPhone 7, 32GB, Black - Fully Unlocked (Renewed)",4.2,9848,Joe M.,5,"After reading a few reviews, I took a chance and ordered the IPhone 7 fully unlocked. I was shock to find a almost new phone, almost flawless, just some hard to notice marks on the corners, you would have to look really close to see or notice it. And yes it was fully unlocked both GSM and CDMA, in other words any carrier from T-Mobile, AT&T, Verizon, ect. I'm happy with it. Update: The phone can with 75% battery life left, does hold charge most of the day. Not bad for a 5 year old phone."
"Apple iPhone 7, 32GB, Black - Fully Unlocked (Renewed)",4.2,9848,Carlos Ronte Jenkins,1,Didn‚Äôt get phone
"Apple iPhone 7, 32GB, Black - Fully Unlocked (Renewed)",4.2,9848,Debbie,4,Good
"Apple iPhone 7, 32GB, Black - Fully Unlocked (Renewed)",4.2,9848,Tom,5,Bought phone for my 12 year old but also purchased OtterBox case . Phone was in good condition and works as it should!
"Apple iPhone 7, 32GB, Black - Fully Unlocked (Renewed)",4.2,9848,NTB,5,"As advertised, great phone, great price"
"Apple iPhone 7, 32GB, Black - Fully Unlocked (Renewed)",4.2,9848,T. J.,1,Verizon techs said no way was it refurbished. Heated up to point of almost burning their ear. My friend sat with them for hours while they tried to get it to work. Piece of junk. Total waste of money. They did approve the return promptly.
"Apple iPhone 7, 32GB, Black - Fully Unlocked (Renewed)",4.2,9848,Amazon Customer,4,So far has been a good phone for the price. Was bought for a teenager.
"Apple iPhone 7, 32GB, Black - Fully Unlocked (Renewed)",4.2,9848,charlotte,1,The camera is messed up it shakes really bad when you try and take a picture with the back camera
"Apple iPhone 7, 32GB, Black - Fully Unlocked (Renewed)",4.2,9848,Amazon Customer,5,I am usually hesitant when buying refurbished phones but I was in desperate need for a new phone and the reviews were good. I have to commend them that. So far it works great! It's not slow and the battery doesn't drain too quickly or anything like that. So for that 5 stars.
"Apple iPhone 7, 32GB, Black - Fully Unlocked (Renewed)",4.2,9848,Tina Baker,5,Perfect description
"Apple iPhone 7, 32GB, Black - Fully Unlocked (Renewed)",4.2,9848,Kenji Matsumoto,4,"Have had it for about a week now, and no problems. Came with 91% battery capacity which was expected. No aftermarket parts that I could tell. Screen looks good. Only complaint was that there was some light paint dust on the back but it is purely cosmetic. I‚Äôll update at month one! 90 day warranty is a nice factor. I was hesitant to buy when I read some of these reviews, but I seem to have gotten it good. So that is possible if you are considering buying. If you don‚Äôt like it, then you‚Äôve got 90 days. There you go bud."
"Apple iPhone 7, 32GB, Black - Fully Unlocked (Renewed)",4.2,9848,Kip Renville,5,Great product for the price
"Apple iPhone 7, 32GB, Black - Fully Unlocked (Renewed)",4.2,9848,Sherie Walker,5,"My iPhone 7 that I had purchased for my son for his birthday October 29th and it came, on his birthday!! The best birthday gift ever!!. Thank you!!!"
"Apple iPhone 7, 32GB, Black - Fully Unlocked (Renewed)",4.2,9848,RRW,5,"The seller was incredibly fast to ship this phone. It came in a white-unmarked box with SIM removal tool and a lighting charger (non apple). The phone is near new condition, not a scratch that I can see. Will activate later today, test battery life, etc. Overall, one nice deal without buying a new phone from a service provider. I always prefer to stay a few models behind the latest and greatest of Apple phones, as the prices are too damn high IMHO. You shouldn't be disappointed with this seller. I will buy from them again, as my wife needs an upgrade soon."
"Apple iPhone 7, 32GB, Black - Fully Unlocked (Renewed)",4.2,9848,Javier Rodriguez,5,"I actually purchased the iPhone as a gift. I waited to hear from them and so far so good. The touch screen works properly. Fingerprint is working. Camera also works. The battery life seems to be working normally , no complaints, I‚Äôm happy that the phone is working well. The condition was in good shape. The person I got it for is very happy with it."
"Apple iPhone 7, 32GB, Black - Fully Unlocked (Renewed)",4.2,9848,Thania guerra,1,Worst purchase ever don't waste time on this item does not even turn on turns mad hot 1st day on arrival does not turn on 2nd day return hopefully all turn out good with money back update later on
"Apple iPhone 7, 32GB, Black - Fully Unlocked (Renewed)",4.2,9848,Andres,5,Realmente muy bueno
"Apple iPhone 7, 32GB, Black - Fully Unlocked (Renewed)",4.2,9848,Amazon Customer,5,I have no complaints . . The phone works excellent and the service wasjust what I expected from Amazon at a killer deal
"Apple iPhone 7, 32GB, Black - Fully Unlocked (Renewed)",4.2,9848,Kiley Madaline Smith,5,It didn‚Äôt come in the Apple box so it didn‚Äôt have the little stick thing to get the SIM card part open but aside from that it came perfectly.
"Apple iPhone 7, 32GB, Black - Fully Unlocked (Renewed)",4.2,9848,Brandon Stalvey,1,I ordered 2 of these for my siblings first phone. I was unaware of a pretty big issue that the 7's had with updates. Apparently companies are capable of fixing the issue but most won't anymore because it's such an older device. So both of my siblings when trying to update were unsuccessful and now they cannot use their service or data on it. It requires the update to use the sim card but fails to update
"Apple iPhone 7, 32GB, Black - Fully Unlocked (Renewed)",4.2,9848,Danny & Bobbie Hughley,1,I didn't expect a lot from a refurbished phone but I was sold what I thought to be a Gold iPhone with 128GB and what I received was a Black iPhone with 32GB internal description. The screen freezes and apps lock up.
"Apple iPhone 7, 32GB, Black - Fully Unlocked (Renewed)",4.2,9848,Amy Julian,1,"This phone does not work. It‚Äôs great to watch movies or send texts but as a phone call, it does not work you cannot hear sound over it whenever anyone calls they can‚Äôt hear me and I can‚Äôt hear them. Definitely not a well refurbished phone. I would not buy from this vendor."
"Apple iPhone 7, 32GB, Black - Fully Unlocked (Renewed)",4.2,9848,Tristan Dominguez,4,The phone is good it works well but the only bad thing is the battery life dies pretty quick
"Apple iPhone 7, 32GB, Black - Fully Unlocked (Renewed)",4.2,9848,Amazon Customer,2,"There is no update instruction, we had to call to customer care to get the instruction and battery is poor"
"Apple iPhone 7, 32GB, Black - Fully Unlocked (Renewed)",4.2,9848,Miriam,1,Este tel√©fono no es lo que ped√≠ yo lo ped√≠ nuevo y este tel√©fono parece estar usado no trae el cargador original
"Apple iPhone 7, 32GB, Black - Fully Unlocked (Renewed)",4.2,9848,Penny Braden,3,Battery life SUCKS
"Apple iPhone 7, 32GB, Black - Fully Unlocked (Renewed)",4.2,9848,Melinda J.,5,Good price for a quick shop for an iPhone
"Apple iPhone 7, 32GB, Black - Fully Unlocked (Renewed)",4.2,9848,B. D. Worth,5,"I really like this phone, everything works great."
"Apple iPhone 7, 32GB, Black - Fully Unlocked (Renewed)",4.2,9848,Familia Orellana,1,"Unfortunately I bought this phone in September and at the beginning of January it did not pick up the network again, it did not allow me to update it, I bought the simcard 3 times and nothing ... currently I changed companies thinking that it was the operator and today that I try it I get no it serves!! I am so sad and disappointed because I thought that because I bought it on Amazon it would last longer, unfortunately it does not work!"
"Apple iPhone 7, 32GB, Black - Fully Unlocked (Renewed)",4.2,9848,Doraid M. Saadawi,5,Good product with a good price
"Apple iPhone 7, 32GB, Black - Fully Unlocked (Renewed)",4.2,9848,Sandra Garrity,5,had almost a year with no problems what so ever Battery still lasts me all day Very happy with my puchases!
"Apple iPhone 7, 32GB, Black - Fully Unlocked (Renewed)",4.2,9848,Mario Novas,1,"El iphone se qued√≥ bloqueado durante una actualizaci√≥n y dej√≥ de funcionar. Me puse en contacto con amazon pero ya hab√≠an pasado 100 d√≠as en lugar de 90 y se desentendieron. Su recomendaci√≥n es que lo vea directamente con apple. EN apple me explicaron que los iphone 7 viene con una falla que ellos arreglaban hasta una fecha. Los iphone 7 que quedan en el mercado ya no est√°n cubiertos. Es por tanto falso que el Iphone que compr√© yo haya sido refurbished porque el fallo ven√≠a de la placa base. Cualquier compra de iphone 7 ""refurbished"" a trav√©s de amazon es susceptible de que ocurra lo mismo."
"Apple iPhone 7, 32GB, Black - Fully Unlocked (Renewed)",4.2,9848,Ali Jernigan,3,The phone works great except headphones won‚Äôt work.:( Seems the port is the issue.
"Apple iPhone 7, 32GB, Black - Fully Unlocked (Renewed)",4.2,9848,Berenice Castro,4,"For the phone being refurbished it was in good condition, very minor scratches. Looked more like new I order this for my mother who needed a new phone, going on almost a year now and have not had any issues with it."
"Apple iPhone 7, 32GB, Black - Fully Unlocked (Renewed)",4.2,9848,Shelby smith,1,i should of read the reviews first before buying
"Apple iPhone 7, 32GB, Black - Fully Unlocked (Renewed)",4.2,9848,Wawsha,2,"The phone had a bad battery that would only last for about 4 hours. Because I was in a situation where I couldn‚Äôt wait for a return, I had to get the battery replaced at my expense. When the technician opened the phone there was clear damage to components on the inside. One component looked like it came out of a phone that had a battery fire. If I wasn‚Äôt in a pinch I would have returned it in a heartbeat."
"Apple iPhone 7, 32GB, Black - Fully Unlocked (Renewed)",4.2,9848,igillliard,4,Birth Day Gift for my Grand children. No complaints ...
"Apple iPhone 7, 32GB, Black - Fully Unlocked (Renewed)",4.2,9848,B.C.,5,Works great!
"Apple iPhone 7, 32GB, Black - Fully Unlocked (Renewed)",4.2,9848,Aimy,3,UPDATE: This company did keep trying to send a different replacement. We‚Äôve finally got a good phone. Thank you. Original review: The phone might be a good product but when buying used it‚Äôs a gamble. And it certainly has been the case buying from this company. It says Amazon certified but it‚Äôs a 3rd party company so who knows what they give you. This is our second time returning a phone back to the them because they are in some way defective. We are kind of left hanging on what to do next and we are still out of a phone. Again.
"Apple iPhone 7, 32GB, Black - Fully Unlocked (Renewed)",4.2,9848,Kiki S.,1,Battery life is not good at all. Only last an hour.
"Apple iPhone 7, 32GB, Black - Fully Unlocked (Renewed)",4.2,9848,tameka,5,Great product!!
"Apple iPhone 7, 32GB, Black - Fully Unlocked (Renewed)",4.2,9848,Yaquelin Gir√≥n,5,I love it.
"Apple iPhone 7, 32GB, Black - Fully Unlocked (Renewed)",4.2,9848,NycPunk13,1,Did not work. Cost me Money in cab fare because I‚Äôm disabled to try to get the phone turned on. They cost me more Money ($24). To try to get the phone turned on. It did not work. Yours t me abrojen phone a din very disappointed. It cost me a lot of time and money and I went without awotki g phone for over 2 weeks because this phone is defective. Being disabled this caused me many problems.
"Apple iPhone 7, 32GB, Black - Fully Unlocked (Renewed)",4.2,9848,Kia Evans,5,I love it
"Apple iPhone 7, 32GB, Black - Fully Unlocked (Renewed)",4.2,9848,Sarge755,2,"Phone came in good condition but poor battery health , it came at 76% battery health and it drains quick"
"Apple iPhone 7, 32GB, Black - Fully Unlocked (Renewed)",4.2,9848,Amazon Customer,5,Everything works! Exactly how was described.
"Apple iPhone 7, 32GB, Black - Fully Unlocked (Renewed)",4.2,9848,P Haley,5,My grandson loves the phone
"Apple iPhone 7, 32GB, Black - Fully Unlocked (Renewed)",4.2,9848,Kindle Customer,1,"Got the phone and guess what?!? The motherboard was shot would not work. Tried 3 different SIM cards went to apple, my carrier store, a tech repair shop, and Best Buy all to be told I‚Äôd need a new motherboard if I wanted to keep the phone."
"Apple iPhone 7, 32GB, Black - Fully Unlocked (Renewed)",4.2,9848,shirley johnson,5,looked new
"Apple iPhone 7, 32GB, Black - Fully Unlocked (Renewed)",4.2,9848,Crystal gillon,5,Battery life is nice decent camera
"Apple iPhone 7, 32GB, Black - Fully Unlocked (Renewed)",4.2,9848,Ty Vaughan,5,"Ordered a silver one and it arrived days early. After reading some reviews, I was kinda worried I had wasted my money and it would come messed up at least somewhat, but nope! Battery Life is at 100%. Charges well even without brand name charger. No scratches, or even fingerprints when I got it. Camera and video function flawlessly, and it was fully unlocked like it said it would be. No issues AT ALL. Recommend 10/10. Thanks Amazon!"
"Apple iPhone 7, 32GB, Black - Fully Unlocked (Renewed)",4.2,9848,Wendy Cecce,5,Very happy with this phone. Took to verizon store last night to get it activated for my son!!! Very fast delivery!!! Sorry for the delay in commenting! Bought another for my daughter recently!!!üòÉ
"Apple iPhone 7, 32GB, Black - Fully Unlocked (Renewed)",4.2,9848,Lisa Mckercher,2,"I switched from Android to IPhone. Horrible decision. Every time it upgrades, which is often, the phone gets worse. It doesn‚Äôt hold a charge and I‚Äôve been inundated with spam texts. There is no fix for this. I have to individually block each spam #. I hate this phone. It‚Äôs great for pictures but I wasn‚Äôt shopping for a camera."
"Apple iPhone 7, 32GB, Black - Fully Unlocked (Renewed)",4.2,9848,Trish Jones,5,Gift
"Apple iPhone 7, 32GB, Black - Fully Unlocked (Renewed)",4.2,9848,tasha mourer,2,"Runs slow , colabirtation is off and screen glitches"
"Apple iPhone 7, 32GB, Black - Fully Unlocked (Renewed)",4.2,9848,aubreonia cornes,5,Phone is compatible with metro however does die fast
"Apple iPhone 7, 32GB, Black - Fully Unlocked (Renewed)",4.2,9848,Sarah Lee,1,"Don‚Äôt do it. Got the phone in December. It is only March and it is literally falling apart inside the case. Came with tiny cracks and a ‚Äúscreen protector‚Äù already on it, but I watched a crack expand across the phone right in front of my eyes as I was using it. Even with the screen protector on. It worked for only 3 months. Not worth it."
"Apple iPhone 7, 32GB, Black - Fully Unlocked (Renewed)",4.2,9848,Devn R Rittenhouse,5,"Very good except the battery life is terrible, if you want battery life go to android"
"Apple iPhone 7, 32GB, Black - Fully Unlocked (Renewed)",4.2,9848,SHAUNA MAJORS,5,It was like brand new
"Apple iPhone 7, 32GB, Black - Fully Unlocked (Renewed)",4.2,9848,Troy Sherwin,5,"The delivery was on time and we received what we ordered. So far, the device is working flawlessly."
"Apple iPhone 7, 32GB, Black - Fully Unlocked (Renewed)",4.2,9848,MiMi,1,Phone worked ok but the battery wouldn't last over 4 hours or less with use they must have forgotten to refurbished it. Always nervous about buying refurbished electronics because there is almost always a reason it was refurbished there's no way to know if it was just a trade in for a newer phone or because it wasn't working.
