product_title,average_rating,total_reviews,review_author,review_rating,review_text
"Apple iPhone 7, 32GB, Black - Fully Unlocked (Renewed)",4.2,9848,Sandy T,5,"Phone took long time arriving, but was packaged nicely and came with charger although the charger stopped working phone still works great"
"Apple iPhone 7, 32GB, Black - Fully Unlocked (Renewed)",4.2,9848,gillyard_1,5,Got it for my daughter for Christmas made a good choice
"Apple iPhone 7, 32GB, Black - Fully Unlocked (Renewed)",4.2,9848,Malik,5,"I really recommend, came in only in 2! Days perfect!"
"Apple iPhone 7, 32GB, Black - Fully Unlocked (Renewed)",4.2,9848,lisa,1,It was a 5GB instead of 32GB very disappointed
"Apple iPhone 7, 32GB, Black - Fully Unlocked (Renewed)",4.2,9848,KIARA MCGEE,5,Bought this for my 10 year old son for Christmas & he loves it. It is still working just fine.
"Apple iPhone 7, 32GB, Black - Fully Unlocked (Renewed)",4.2,9848,Jordy Richardson,1,The phone would not work it would not get out of down loading iso it wouldn‚Äôt allow me to put my phone info on it just kept downloading but never would fully load
"Apple iPhone 7, 32GB, Black - Fully Unlocked (Renewed)",4.2,9848,Anh Tran,1,really bad battery. 100% to 0% within minutes.
"Apple iPhone 7, 32GB, Black - Fully Unlocked (Renewed)",4.2,9848,Philippe J. Pommez,5,Working fine . Battery life seems a bit reduced but not a problem. Definetely the right option if you just want the basics.
"Apple iPhone 7, 32GB, Black - Fully Unlocked (Renewed)",4.2,9848,Ren,5,Save yourself some trouble and get the 64GB one
"Apple iPhone 7, 32GB, Black - Fully Unlocked (Renewed)",4.2,9848,Roy D. Jackson,5,Fast service and phone works great.
"Apple iPhone 7, 32GB, Black - Fully Unlocked (Renewed)",4.2,9848,Marty,5,good
"Apple iPhone 7, 32GB, Black - Fully Unlocked (Renewed)",4.2,9848,Karlene D. Thompson,1,Item had a known defect according to Apple and has been returned and replaced.
"Apple iPhone 7, 32GB, Black - Fully Unlocked (Renewed)",4.2,9848,mika,4,Screen had a burn in from something not sure. It works fine and no cosmetic defects other then the screen
"Apple iPhone 7, 32GB, Black - Fully Unlocked (Renewed)",4.2,9848,Vanessa McQueen,1,"The phone worked amazingly, then it died one night and when it came back on from charging the Touchscreen and Wifi both didn't work."
"Apple iPhone 7, 32GB, Black - Fully Unlocked (Renewed)",4.2,9848,Amazon Customer,4,Very good product
"Apple iPhone 7, 32GB, Black - Fully Unlocked (Renewed)",4.2,9848,Shaniya,1,Phone is not unlocked. If you use Verizon straight y‚Äôall you will not be able to turn on your phone. I had to get a refund.
"Apple iPhone 7, 32GB, Black - Fully Unlocked (Renewed)",4.2,9848,Amanda Tomlin,1,I bought this phone thinking it was a cheaper option to buying a brand new phone. The phone came very fast. The packaging looked legit. But as soon as I put my old perfectly working SIM card in the new device it said there was no service. I looked it up on google. Tried calling my cellphone provider on a different cellphone and the phone was the problem. Out of the box it worked fine. Could be used as an iPod but there was no service. Works fine technically but not $169 for a iPhone that doesn‚Äôt work as a phone.
"Apple iPhone 7, 32GB, Black - Fully Unlocked (Renewed)",4.2,9848,Claire Q.,5,Looks new!! Satisfied with my purchased. Battery heath was at 81% when I received it. Awesome product!
"Apple iPhone 7, 32GB, Black - Fully Unlocked (Renewed)",4.2,9848,Julie Meador,5,Everything was great
"Apple iPhone 7, 32GB, Black - Fully Unlocked (Renewed)",4.2,9848,Duct man,4,very nice phone for the price everything works good.
"Apple iPhone 7, 32GB, Black - Fully Unlocked (Renewed)",4.2,9848,ginna,4,Overall a nice phone but the battery is short but it comes with age of the product.
"Apple iPhone 7, 32GB, Black - Fully Unlocked (Renewed)",4.2,9848,Elizabeth Lane,5,Phone works well
"Apple iPhone 7, 32GB, Black - Fully Unlocked (Renewed)",4.2,9848,Dave,1,When first turned on the phone it said corrupt battery and when I messaged them about it they got back to me once just asking for certain serial numbers and after I gave them to them they never got back to me and now dealing with a bad battery which is getting to be very frustrating. Don‚Äôt purchase from them because they guaranteed about 90% battery but this was way below that and did nothing to help or replace it or anything!
"Apple iPhone 7, 32GB, Black - Fully Unlocked (Renewed)",4.2,9848,Ashlie crosby,5,All working perfectly
"Apple iPhone 7, 32GB, Black - Fully Unlocked (Renewed)",4.2,9848,Robin t.,5,So first I got a glitchy phone with bad battery I called them and they were so sweet they mailed a new one that they triple checked and no issues!
"Apple iPhone 7, 32GB, Black - Fully Unlocked (Renewed)",4.2,9848,Gechele montford,4,Battery not good
"Apple iPhone 7, 32GB, Black - Fully Unlocked (Renewed)",4.2,9848,MoNiquee Bee,4,Good condition works just fine
"Apple iPhone 7, 32GB, Black - Fully Unlocked (Renewed)",4.2,9848,Jeanrichardtherasse,5,I love everything about this phone üì± it got great quality
"Apple iPhone 7, 32GB, Black - Fully Unlocked (Renewed)",4.2,9848,Shawn,5,Need a new phone
"Apple iPhone 7, 32GB, Black - Fully Unlocked (Renewed)",4.2,9848,Gene,3,"Bought this phone for my daughter. Thought that ""renewed"" doesn't really mean much, but yes it does. Phone's mic is weak, isn't always heard on the other end. For example, every time my daughter is on this phone talking to me, I can barely hear her from time to time. He audio keeps disappearing and coming back, even though she has a strong signal. Another problem is with the battery life. It's extremely poor. Phone looses its charge quiet frequently. I turned off all possible notifications. Her phone is very clean, no garbage apps, cache is clean, no internet files, lots of free memory and still battery looses its charge quiet fast."
"Apple iPhone 7, 32GB, Black - Fully Unlocked (Renewed)",4.2,9848,Juan,4,Phone was in great shape small scratch but in great shape over all.
"Apple iPhone 7, 32GB, Black - Fully Unlocked (Renewed)",4.2,9848,Cherie Stevenson,5,Needed a new phone and this one worked for whst we needed. Nice touch screen. Nice upgrade from the iPhone 5.
"Apple iPhone 7, 32GB, Black - Fully Unlocked (Renewed)",4.2,9848,Edgar Patete,5,Just like new everything works accordingly best phone I‚Äôve ever had
"Apple iPhone 7, 32GB, Black - Fully Unlocked (Renewed)",4.2,9848,Elissa Wilcox,5,works great!!! very happy overall
"Apple iPhone 7, 32GB, Black - Fully Unlocked (Renewed)",4.2,9848,ronald priebe,5,The battery live only couple hours
"Apple iPhone 7, 32GB, Black - Fully Unlocked (Renewed)",4.2,9848,Chucky,5,This phone works like new! Very pleased with it.
"Apple iPhone 7, 32GB, Black - Fully Unlocked (Renewed)",4.2,9848,Heather,5,Bought this for my daughter she loves no problems whatsoever
"Apple iPhone 7, 32GB, Black - Fully Unlocked (Renewed)",4.2,9848,Amazon customer,1,Battery life didnt last past 2 1/2 months and didnt get full refund of phone.
"Apple iPhone 7, 32GB, Black - Fully Unlocked (Renewed)",4.2,9848,Shova,1,It says renowned in app but the body was scratched. Really disappointed!!!
"Apple iPhone 7, 32GB, Black - Fully Unlocked (Renewed)",4.2,9848,G-UNIT,5,I use it everyday with no issues
"Apple iPhone 7, 32GB, Black - Fully Unlocked (Renewed)",4.2,9848,Kelli,1,The phone gets so hot when charging and the battery might last 30 min from 100% to dead if this is a renewed phone it‚Äôs garbage at least you all could have put a good battery in it I don‚Äôt even think this phone is a real apple it‚Äôs just a tad smaller in length than my real apple iPhone 7. I think y‚Äôall make copies of the real apple products and fake them then sell the junk to us I‚Äôll never buy another item from Amazon again I‚Äôm deleting my account just think how much your going to lose I buy a lot well that‚Äôs all if anyone wants to no how good this phone is just go to the dollar store and buy a cheap a** go phone and it will be better than this
"Apple iPhone 7, 32GB, Black - Fully Unlocked (Renewed)",4.2,9848,Jane Austen,3,Home button a little difficult to use.
"Apple iPhone 7, 32GB, Black - Fully Unlocked (Renewed)",4.2,9848,Amazon Customer,5,Phoned works perfectly
"Apple iPhone 7, 32GB, Black - Fully Unlocked (Renewed)",4.2,9848,Abby,5,Great phone I love it tbh . Haven't fully used it though tbh but great
"Apple iPhone 7, 32GB, Black - Fully Unlocked (Renewed)",4.2,9848,claudia collazos,4,"Me gusto el tama√±o,lo pude usar fuera del pa√≠s, me encanto pero dura poco las bater√≠as."
"Apple iPhone 7, 32GB, Black - Fully Unlocked (Renewed)",4.2,9848,Stetson salinas,1,"I ordered this iPhone and immediately noticed that the battery dies within an hour - while only listening to music! I tested it multiple times over the next few days, and it rapidly died each time. The Seller states to email and call before leaving a negative review - I must have called 30+ times, and I emailed, but no answers. I'm returning the product and definitely expect a refund. I ordered from another Seller."
"Apple iPhone 7, 32GB, Black - Fully Unlocked (Renewed)",4.2,9848,Kimberley A.,5,Great phone for the price
"Apple iPhone 7, 32GB, Black - Fully Unlocked (Renewed)",4.2,9848,Mesha,1,Garbage. Stopped working 7 months later. Has a software issue (stuck in a restart loop) and nobody can even fix it. It can‚Äôt be restored or anything. Waste of money. I‚Äôll never buy a electronic device from Amazon.
"Apple iPhone 7, 32GB, Black - Fully Unlocked (Renewed)",4.2,9848,Skye Collins,1,"I was unaware when I bought this phone that Apple had recalled all IPhone 7s for a ‚Äúno service‚Äù error. Unfortunately, I encountered this error and was unable to connect it to service which completely defeated the point of me buying it. I ended up having to buy an iPhone 11 from Walmart, which costs a little more than this phone did. I recommend choosing a different phone as this was most definitely not worth the money or time I spent trying to set it up."
"Apple iPhone 7, 32GB, Black - Fully Unlocked (Renewed)",4.2,9848,Amber Lawson,1,Doesn‚Äôt work. Keeps kicking the carrier info off and won‚Äôt let my daughter use it as cellular at all.
"Apple iPhone 7, 32GB, Black - Fully Unlocked (Renewed)",4.2,9848,Juan,5,Is good
"Apple iPhone 7, 32GB, Black - Fully Unlocked (Renewed)",4.2,9848,Tasha Martin,5,Phone works great will be buying another phone soon from Amazon! Good starter Iphone
"Apple iPhone 7, 32GB, Black - Fully Unlocked (Renewed)",4.2,9848,Cydmary,1,üò©
"Apple iPhone 7, 32GB, Black - Fully Unlocked (Renewed)",4.2,9848,boy,5,It looks like new. I will recommend this type to anyone. Great way to save money.
"Apple iPhone 7, 32GB, Black - Fully Unlocked (Renewed)",4.2,9848,Mar,1,The battery life would go from 25% to 0 in seconds. Returned it.
"Apple iPhone 7, 32GB, Black - Fully Unlocked (Renewed)",4.2,9848,Britaney,1,Speaker is messed up have to put it on speaker phone to talk to anyone also already actived the phone with my cell phone carried never returned it cause they charged me 30$ to activate then 30$ to inactive it and then another 30$ to active my old phone again and by the time all that would have been said and done this phone would have charged me almost and extra 130$ On top of the 222$ I paid for it üôÑüôÑüôÑ
"Apple iPhone 7, 32GB, Black - Fully Unlocked (Renewed)",4.2,9848,Taylor,5,I am so impressed!! I was a little nervous because the bad reviews were really bad and I didn‚Äôt want just throw away $200. Buuttttt AMAZING! It was unlocked as advertised and I was easily able to set it up with MetroPCS. The phone looks brand new. It was fully charged and works great. My only complaint is that the home button because I have to press down a little harder then I did my old iPhone but its not a big deal. I‚Äôm very satisfied!!!
"Apple iPhone 7, 32GB, Black - Fully Unlocked (Renewed)",4.2,9848,Naomi Irons,3,I bought this for my husband's birthday. He really liked it at first. But the battery life didn't last very long. It became too inconvenient to constantly be charging it and we ended up having to get him another phone. Very disappointing.
"Apple iPhone 7, 32GB, Black - Fully Unlocked (Renewed)",4.2,9848,Joshua nyangeri,5,the phone is smart but I cant open coz it requires passcord.kindly help.i am travelling out the country for vacation.give instruction by email
"Apple iPhone 7, 32GB, Black - Fully Unlocked (Renewed)",4.2,9848,felix,3,Well I guess I‚Äôm satisfied
"Apple iPhone 7, 32GB, Black - Fully Unlocked (Renewed)",4.2,9848,JenKen,1,This phone did not work! It doesn‚Äôt connect to our phone SIM card and can only be on WiFi. It was also broken at opening where the SIM card goes in. I am extremely disappointed!!
"Apple iPhone 7, 32GB, Black - Fully Unlocked (Renewed)",4.2,9848,Allen,1,"I have had this phone for two months. When I first purchased this item it was working perfectly, it had been unlocked, I had activated the phone with my Tmobile sim card and the device would make calls, text messages and all cellular service features.however there was ""other system data"" of 20 GB worth that would not allow me to further update the device. About a month later, due to incapability of updating from the ""other system data"" I could no longer make any phone calls or messages with the device. I reached out to Apple Support to learn that the device did not have an update issue, it was not properly unlocked and had simply become locked back to the original Verizon carrier. The device cannot activate again after resetting from Apple. As i am not a verizon customer nor am I the original owner I can no longer use this phone. It is a brick. It is stuck telling me it cannot be activated. BUYER BEWARE This seller does NOT unlock their phones from the carrier and later after purchase it will become locked and bricked."
"Apple iPhone 7, 32GB, Black - Fully Unlocked (Renewed)",4.2,9848,Amazon Customer,3,"The phone was great and worked nicely. Within a few days of using the Home Button began to stick. It became more and more difficult to get the Home Button to work. I tried for one whole day, randomly trying, to get a response. I could feel what felt like movement in the backside of the phone with the Home Button, also, when I wisked open screen from the background, there was a feeling of movement and slight noise. I decided if this was an issue now, if I kept the phone the problems could be worse. So, I had 60 days to return and made a decision to return."
"Apple iPhone 7, 32GB, Black - Fully Unlocked (Renewed)",4.2,9848,Amazon Customer,5,Very happy with the purchase
"Apple iPhone 7, 32GB, Black - Fully Unlocked (Renewed)",4.2,9848,Leonardo Jennings,5,Nice fit
"Apple iPhone 7, 32GB, Black - Fully Unlocked (Renewed)",4.2,9848,Amazon Customer,1,"this phone was not unlocked, so what's the point?"
"Apple iPhone 7, 32GB, Black - Fully Unlocked (Renewed)",4.2,9848,Sarah L Gunnard,1,The phone was crusty and gross when we got it and it took about 20 minutes for it to turn on to the main menu to set it up. In the middle of setting up the phone the touch screen stopped working. So now I am logged in to iCloud on the phone and I cannot log out. The screen still won‚Äôt turn on so unfortunately I have to send it back while I am still logged in to my apple account which I am not happy about.
"Apple iPhone 7, 32GB, Black - Fully Unlocked (Renewed)",4.2,9848,Holly,5,I was super nervous this phone wasn‚Äôt going to to work per some bad reviews - but it works perfect! Great battery life- and switching the sims card from the the old iPhone to the new one - was so easy. Just for reference- the original iPhone was through Verizon. I did not need to contact Verizon to activate or anything after the SIM card was switched. IOS was updated when I receive the item.
"Apple iPhone 7, 32GB, Black - Fully Unlocked (Renewed)",4.2,9848,EriYanna,3,The phone came slightly damaged and the battery life is horrible but nonetheless the phone is wonderful.
"Apple iPhone 7, 32GB, Black - Fully Unlocked (Renewed)",4.2,9848,Amazon Customer,5,I have used my phone for over 6 months now and really like it. Especially compared to the newer ones and their high price!
"Apple iPhone 7, 32GB, Black - Fully Unlocked (Renewed)",4.2,9848,Yamesse Lacy,4,My son likes the phone so far. Battery life do suck a little but hey you can't win them all.
"Apple iPhone 7, 32GB, Black - Fully Unlocked (Renewed)",4.2,9848,Saah,5,Good product
"Apple iPhone 7, 32GB, Black - Fully Unlocked (Renewed)",4.2,9848,CHRYSTAL Amidon,5,Works great
"Apple iPhone 7, 32GB, Black - Fully Unlocked (Renewed)",4.2,9848,Amanda,1,"The phone was listed as unlocked for all carriers (specifically AT&T) but after 6+ hours with technical support and (3) trips to my local AT&T store they advised me that it looks like this phone came from overseas and will NEVER work in the United States. I spent a LOT of time trying to activate this phone, and it was never going to activate. In the middle of the return process now. Long story short: Huge waste of time and big, fat bummer."
"Apple iPhone 7, 32GB, Black - Fully Unlocked (Renewed)",4.2,9848,Laken,5,Great purchase. Love it! Everything as expected!!!
"Apple iPhone 7, 32GB, Black - Fully Unlocked (Renewed)",4.2,9848,Joann Lampkin,1,"I purchased this phone received a damage scratchy phone...I was to get a $25coupon from the seller to purchase a case but I couldn't get to removed the feed back comment by doing so, the phone battery life last for 1hour and half it take charging for 10 days now it completely stop working.for me to return this phone I will be paying the $185.65 three times to return plus have to pay to collected it when it returns....this was the worst mistake I ever made purchasing this phone ...I need my money back didn't get my money worth smfh."
"Apple iPhone 7, 32GB, Black - Fully Unlocked (Renewed)",4.2,9848,Felicia Martinez,5,It‚Äôs perfect! Love it and love the complimentary gifts! Thank you so much‚ô•Ô∏è
"Apple iPhone 7, 32GB, Black - Fully Unlocked (Renewed)",4.2,9848,Adam Bosler,1,Very scratchy sounding for the person on the other line. Said I sound like a robot when I have them on speaker phone
"Apple iPhone 7, 32GB, Black - Fully Unlocked (Renewed)",4.2,9848,Jean J. Glas C,3,"El tel√©fono esta operativo, pero llego sin aud√≠fonos, sin cargador y no vi al comprarlo que no lo inclu√≠a. Me parece mal enterarme al recibir. De igual forma, muchos detalles en la carcaza por la parte trasera, como si fuera usado anteriormente."
"Apple iPhone 7, 32GB, Black - Fully Unlocked (Renewed)",4.2,9848,Ceferino T.,4,Looks new to me even though it‚Äôs renewed. 4 stars.
"Apple iPhone 7, 32GB, Black - Fully Unlocked (Renewed)",4.2,9848,Gomzy,1,"Unless you plan to use this phone only for a month, don‚Äôt buy these phones. My phone stopped working within months of use and the seller says they are not responsible. Have not ever dropped or mishandled the phone once. This Is a scam selling end of life products and calling it renewed. Would be better off buying from an unreliable Craigslist seller. At least you might get a cheaper price."
"Apple iPhone 7, 32GB, Black - Fully Unlocked (Renewed)",4.2,9848,Angela Grier,5,Item was as described and shipping was great. Very please with item
"Apple iPhone 7, 32GB, Black - Fully Unlocked (Renewed)",4.2,9848,Sol Black,4,"This phone is perfect except it does not work with Verison, as indicated in the listing. It does use the same technology but something about it will not allow use with Verison. My Daughter will change to another carrier to fix the problem because she loves this phone."
"Apple iPhone 7, 32GB, Black - Fully Unlocked (Renewed)",4.2,9848,Toya Tickles,5,Overall in great condition perfect
"Apple iPhone 7, 32GB, Black - Fully Unlocked (Renewed)",4.2,9848,customer,5,surprised to see that it had no scratches
"Apple iPhone 7, 32GB, Black - Fully Unlocked (Renewed)",4.2,9848,Ginnifer Berlyn,2,Didn‚Äôt come with any kind of paperwork and it‚Äôs working but the touchscreen can freeze up at times.
"Apple iPhone 7, 32GB, Black - Fully Unlocked (Renewed)",4.2,9848,Cortney C. Nelson,1,Phone didn‚Äôt last very long. Had to have the battery replaced when it arrived.
"Apple iPhone 7, 32GB, Black - Fully Unlocked (Renewed)",4.2,9848,green booksellers,5,The package came quicker than expected. Works perfect.
"Apple iPhone 7, 32GB, Black - Fully Unlocked (Renewed)",4.2,9848,Kathy E,1,"Will be returning, 73% battery life, very disappointed as Amazon guarantees at least 80%. Wish this was checked before it was sent out"
"Apple iPhone 7, 32GB, Black - Fully Unlocked (Renewed)",4.2,9848,Eduardo and Jacklyn,1,"Couldn't get it hooked up,supposed to be fully unlocked and its not,I reached out to them and they haven't replied at all.Never again"
"Apple iPhone 7, 32GB, Black - Fully Unlocked (Renewed)",4.2,9848,Joshua Romines,1,Bot satisfied at all. I've had to do multiple updates to make and receive calls and texts. Works for 1 day and then I have to do another update again.
"Apple iPhone 7, 32GB, Black - Fully Unlocked (Renewed)",4.2,9848,Ron,4,Good
"Apple iPhone 7, 32GB, Black - Fully Unlocked (Renewed)",4.2,9848,Casey Primm,5,My son loves this phone battery last all day or most of the day. He's so excited bout his phone
"Apple iPhone 7, 32GB, Black - Fully Unlocked (Renewed)",4.2,9848,Julian,5,"Good phone came in perfect conditon like new , would reccomend this phone to anyone Body had no dings screen is perfect"
"Apple iPhone 7, 32GB, Black - Fully Unlocked (Renewed)",4.2,9848,Arianna Hernandez,1,"Phone dies very quickly often before 1%, screen glitches and now doesn‚Äôt play audio through headphones"
"Apple iPhone 7, 32GB, Black - Fully Unlocked (Renewed)",4.2,9848,Tyrone G,4,What more can I say other than impressed! I purchased this iPhone for my son because his previous iPhone got the infamous screen glitch and I was not about to shell out $800 on a new phone. I was first nervous about buying used phone but the Amazon renew warranty made me feel a bit comfortable. Anyway I received the phone and it looked great! It looked new. It works just fine and I‚Äôm happy. On top of that I was given a free upgrade to the 128gb phone. I definitely appreciated that. After 2 months I am still impressed and amazed. I highly recommend!
"Apple iPhone 7, 32GB, Black - Fully Unlocked (Renewed)",4.2,9848,govanna gamez,5,Great for price it was like new! Fast shipping will purchase product again
"Apple iPhone 7, 32GB, Black - Fully Unlocked (Renewed)",4.2,9848,Amazon Customer,5,"Private use. Phone looks like new, no problems."
"Apple iPhone 7, 32GB, Black - Fully Unlocked (Renewed)",4.2,9848,Mary,5,Comes as described works nicely.
"Apple iPhone 7, 32GB, Black - Fully Unlocked (Renewed)",4.2,9848,Kevern Cyrus,4,Everything works fine !! Thanks a lot to the seller for ah good product !!
"Apple iPhone 7, 32GB, Black - Fully Unlocked (Renewed)",4.2,9848,Amazon Customer,1,Wont boot at all after 3 months usage. Phone wont turn on even when being plugged in for hours. Black screen with no logo or anything else.
"Apple iPhone 7, 32GB, Black - Fully Unlocked (Renewed)",4.2,9848,Taylor Meeks,5,Great for someone trying to try apple with all the phones they have. I did and I actually love I‚Äôm going to look into buying the newer one soon.
"Apple iPhone 7, 32GB, Black - Fully Unlocked (Renewed)",4.2,9848,Anne,1,It took wayyyy to long to get here and the reviews were pretty bad yet I still bought it for some reason. DO NOT BUY
"Apple iPhone 7, 32GB, Black - Fully Unlocked (Renewed)",4.2,9848,Katherine Ward,4,"The sim card reader is malfunctioning, however the seller was willing to work with me, and gave me a partial refund for repair."
"Apple iPhone 7, 32GB, Black - Fully Unlocked (Renewed)",4.2,9848,Amazon Customer,1,"Battery came degraded, not sure how you sell a phone claimed to be ‚Äúrefurbished/renewed‚Äù with out actually investing in renewing the phone. Seems almost like a scam. Lesson learned."
"Apple iPhone 7, 32GB, Black - Fully Unlocked (Renewed)",4.2,9848,Franklin v.,5,Me agrado todo
"Apple iPhone 7, 32GB, Black - Fully Unlocked (Renewed)",4.2,9848,Bryan Gonz√°lez,5,Todo bien
"Apple iPhone 7, 32GB, Black - Fully Unlocked (Renewed)",4.2,9848,Lawrence Acosta,5,"The phone had a scratch on the screen but disappeared after I put on a screen protector, the battery life could have been better, but I‚Äôm not complaining, I‚Äôm loving my phone and I won‚Äôt highly recommend to purchase."
"Apple iPhone 7, 32GB, Black - Fully Unlocked (Renewed)",4.2,9848,Travis F.,1,"The seller I bought from (Electronic Deals) sent me a phone with 69% battery health. Even though the Amazon description clearly says 80% or above. The health dropped to 68% the next day, and then wouldn't even hold a charge. If they're not even simply checking if a number in the settings is above 80% (a simple yes or no), then you have to wonder if they're really inspecting these at all. These phones are good prices and it's easy to return them, but still annoying for it to be sent without passing a simple inspection check and potentially leave people without a phone another few days while they return and wait for a new one. I highly recommend everyone to check the battery health right when you receive the phone before you waste your time installing stuff/setting up."
