product_title,average_rating,total_reviews,review_author,review_rating,review_text
"Apple iPhone 7, 32GB, Black - Fully Unlocked (Renewed)",4.2,9848,Doreen Corliss,1,This phone has absolutely no battery life
"Apple iPhone 7, 32GB, Black - Fully Unlocked (Renewed)",4.2,9848,thomas coleman,4,The phone has messed up I can‚Äôt dial or answer on it it‚Äôs still brand new haven‚Äôt drop it or nothing
"Apple iPhone 7, 32GB, Black - Fully Unlocked (Renewed)",4.2,9848,Lynda Pittman,5,Nothing
"Apple iPhone 7, 32GB, Black - Fully Unlocked (Renewed)",4.2,9848,Kamilah,5,üëç
"Apple iPhone 7, 32GB, Black - Fully Unlocked (Renewed)",4.2,9848,Juan Carlos rivera nieto,1,Se descarga muy r√°pido. No sirve la bater√≠a
"Apple iPhone 7, 32GB, Black - Fully Unlocked (Renewed)",4.2,9848,lloyd,1,Battery was junk and supposed to be refurbished!!
"Apple iPhone 7, 32GB, Black - Fully Unlocked (Renewed)",4.2,9848,Cori L Reece,5,Bought phone and within 24 hours of recieving product it stopped working. Contacted seller they offered 20$ to replace the battery that cost 60$ and then I also had to replace the charging port. I would not recommend buying from them unless you plan on rebuilding the complete phone again.
"Apple iPhone 7, 32GB, Black - Fully Unlocked (Renewed)",4.2,9848,Meet,2,"That is one reason I like brand new iPhones, otherwise, the battery starts dying super quick because they are not original batteries. I am glad it happened during the return period. I sent it back. Better to spend more than sorry."
"Apple iPhone 7, 32GB, Black - Fully Unlocked (Renewed)",4.2,9848,Jose Lezcano,4,Great phone
"Apple iPhone 7, 32GB, Black - Fully Unlocked (Renewed)",4.2,9848,Clara,4,"pro - nice condition, great battery life, responsive screen, everything i expected Con- the charger base provided seemed random and the tape they used left it sticky"
"Apple iPhone 7, 32GB, Black - Fully Unlocked (Renewed)",4.2,9848,Mary Joanna Fugal,5,Came with screen protector which was awe! Works great right out of the box. No issues so far.
"Apple iPhone 7, 32GB, Black - Fully Unlocked (Renewed)",4.2,9848,Kattwhite,1,I bought this phone in July and by December it started having issues. Now it doesn't read the SIM card at all so the phone will not work. NEVER buying renewal phone from Amazon again. What I paid for the Renewed phone I know can get a brand new one for a little less. SO ANGRY right now. Very dissatisfied customer.
"Apple iPhone 7, 32GB, Black - Fully Unlocked (Renewed)",4.2,9848,Kelvin Rodriguez,5,Ok
"Apple iPhone 7, 32GB, Black - Fully Unlocked (Renewed)",4.2,9848,PhillyD,5,Phone works fine. I'm not a big user and don't use many functions. Mostly for phone and camera.
"Apple iPhone 7, 32GB, Black - Fully Unlocked (Renewed)",4.2,9848,Rosemary Sanchez,5,I liked it alot
"Apple iPhone 7, 32GB, Black - Fully Unlocked (Renewed)",4.2,9848,Binh,1,"I bought an iphone 7 on July 13, 2020; it just stopped receiving a phone signal since Jan 1, 2021. The phone is literally less than half a year old since I purchased it. I tried to contact the seller to see if there is a solution. But I haven't heard anything from him/her. Really really bad customer service and terrible products he/she is selling."
"Apple iPhone 7, 32GB, Black - Fully Unlocked (Renewed)",4.2,9848,Sadiyah Na Phoniey,5,"The phone worked for 1-2months. After that, the would not charge. Don‚Äôt this phone or anyone sold on Amazon. Save your money and buy it from apple."
"Apple iPhone 7, 32GB, Black - Fully Unlocked (Renewed)",4.2,9848,K. Pollard,5,"Excellent seller- Refurbished electronics at times may get a bad wrap, and sometimes not everything is perfect- but this seller made everything right IMMEDIATELY without hesitation or a a long process. Our ‚Äúnew‚Äùphone is perfect, working flawlessly & made the perfect gift! Thank you Hybrid IT!"
"Apple iPhone 7, 32GB, Black - Fully Unlocked (Renewed)",4.2,9848,jada,1,No battery life
"Apple iPhone 7, 32GB, Black - Fully Unlocked (Renewed)",4.2,9848,EIRA TRIANA,1,"I bought this iPhone and was a lime , the battery and the phone wasn‚Äôt unlocked."
"Apple iPhone 7, 32GB, Black - Fully Unlocked (Renewed)",4.2,9848,crystal,5,Yea
"Apple iPhone 7, 32GB, Black - Fully Unlocked (Renewed)",4.2,9848,Zoey b,5,It works and there wasn't a single scratch! It was also very well packaged!
"Apple iPhone 7, 32GB, Black - Fully Unlocked (Renewed)",4.2,9848,Jim B.,1,Got IPhone 7 right away. Never worked. Sent it back and over a week later am waiting on the re-fund.
"Apple iPhone 7, 32GB, Black - Fully Unlocked (Renewed)",4.2,9848,Amazon Customer,3,My notification doesn‚Äôt work on my messages that sucks but everything else is fine
"Apple iPhone 7, 32GB, Black - Fully Unlocked (Renewed)",4.2,9848,Gabby,4,it did NOT come with a sim card but overall good
"Apple iPhone 7, 32GB, Black - Fully Unlocked (Renewed)",4.2,9848,Carol cuneo,5,The first phone they sent me was defective. I messaged them. I sent it back and sent me a new one right away. They are very honest!
"Apple iPhone 7, 32GB, Black - Fully Unlocked (Renewed)",4.2,9848,Natalie Henry,5,The phone is in excellent condition and I am satisfied with my purchase.
"Apple iPhone 7, 32GB, Black - Fully Unlocked (Renewed)",4.2,9848,T Mccullough,5,Seller is wonderful!! Bought this for my grandson but Verizon no longer supports a 7. I will definitely buy from again! Thank you 5 STAR SELLER!
"Apple iPhone 7, 32GB, Black - Fully Unlocked (Renewed)",4.2,9848,Laurie Lundy,1,"While trying to charge the phone, it got extremely HOT! If it had not been removed in time it would have burned a spot on the wood table. It was so hot I was fearful it might catch on fire!"
"Apple iPhone 7, 32GB, Black - Fully Unlocked (Renewed)",4.2,9848,chrishunda holbert,1,I‚Äôm very upset with the company the phones will not allow FaceTime to work...had I known this I would not hve purchase theses phones from this company
"Apple iPhone 7, 32GB, Black - Fully Unlocked (Renewed)",4.2,9848,Erika Reyes,3,I thought the battery life would be better for the price I paid
"Apple iPhone 7, 32GB, Black - Fully Unlocked (Renewed)",4.2,9848,Justin,2,Amazon guaranteed that the battery capacity would be above 80% but it is only 75%
"Apple iPhone 7, 32GB, Black - Fully Unlocked (Renewed)",4.2,9848,Justin smith,1,Battery life dies fast and phone is already glitchy
"Apple iPhone 7, 32GB, Black - Fully Unlocked (Renewed)",4.2,9848,Bill Shull,5,Bought for granddaughter. It works great and took latest iOS updates
"Apple iPhone 7, 32GB, Black - Fully Unlocked (Renewed)",4.2,9848,Elizabeth Brightwell,5,Perfect! Just like new!!!
"Apple iPhone 7, 32GB, Black - Fully Unlocked (Renewed)",4.2,9848,Patricia Morman,5,Like
"Apple iPhone 7, 32GB, Black - Fully Unlocked (Renewed)",4.2,9848,Sydnie white,1,"So I got this phone, when it originally came, it had more damage than what was listed so I returned it. The next one that came in had little to no damage so I was excited. However, after the 30 day return window (of course) the phone has been having all sorts of problems. I have audio issues with my phone on speaker, the keyboard gets stuck constantly, and the battery life is pretty much non-existent. Incredibly pissed I bought this for 230$ and now can only get 60$ if I sell it back. Just a warning, but if you buy your phone from here you are gambling with your money honestly. So just do a payment plan through your provider or get it from apple and spare yourself the frustration"
"Apple iPhone 7, 32GB, Black - Fully Unlocked (Renewed)",4.2,9848,Shannon DeMarino,5,"I ordered this phone, already knowing that I didn't want an IPhone, unfortunately this phone got very hot very fast, luckily the seller is very understanding and very helpful. I am returning the phone for a refund. I have to say that the fingerprint sensor is great, as well as the touchscreen. As far as the battery goes, well it's an IPhone, be prepared to always have your charger with you. This would have been a great value for the money for sure, but unfortunately I couldn't deal with how hot the phone would get."
"Apple iPhone 7, 32GB, Black - Fully Unlocked (Renewed)",4.2,9848,Andrew Clay,1,"The phone glitches all the time by itself, it clicks random things and loads random pages... Definitely not what I expected for what I paid"
"Apple iPhone 7, 32GB, Black - Fully Unlocked (Renewed)",4.2,9848,H. G.,4,Everything works well. Very happy. The best part was the new phone's ability to copy everything from my old phone! It was fast too!
"Apple iPhone 7, 32GB, Black - Fully Unlocked (Renewed)",4.2,9848,"Herman Pickens, shopper",5,I liked that this item is exactly what I wanted
"Apple iPhone 7, 32GB, Black - Fully Unlocked (Renewed)",4.2,9848,LO,1,The phone has software issue which does not allow wifi usage.
"Apple iPhone 7, 32GB, Black - Fully Unlocked (Renewed)",4.2,9848,Imaothog,1,Do not buy. Our phone software was faulty. The first update killed the phone per the Apple Store. Said it was a common problem with the 7's.
"Apple iPhone 7, 32GB, Black - Fully Unlocked (Renewed)",4.2,9848,Juan P. Gomez,5,El tel√©fono est√° excelente no tengo ning√∫n problema asta hora la bater√≠a es de larga duraci√≥n y estaba desbloqueado cuando lo compre
"Apple iPhone 7, 32GB, Black - Fully Unlocked (Renewed)",4.2,9848,Kimberly Manier,2,The battery arrived below (75 percent) the advertised level.
"Apple iPhone 7, 32GB, Black - Fully Unlocked (Renewed)",4.2,9848,Stephani,1,I bought this phone to replace my sons old phone. Ever since he got it the battery will not keep a charge. Which upsets him very much
"Apple iPhone 7, 32GB, Black - Fully Unlocked (Renewed)",4.2,9848,Mo Cheeks,5,The iPhone 7 was in great condition. Just too small for my fingers to type accurately.
"Apple iPhone 7, 32GB, Black - Fully Unlocked (Renewed)",4.2,9848,Andrea B.,4,"Overall good product! The cameras kind of glitches at times but it overall works. The battery dies very quickly, but it works perfectly fine even without a sim card. Very good product!"
"Apple iPhone 7, 32GB, Black - Fully Unlocked (Renewed)",4.2,9848,laura,1,Plugged it in today and transferred my data to the phone. Phone isn‚Äôt charging past 60 %. Going through battery settings shows the battery is severely compromised. I had to order a replacement battery off Amazon today. I would suggest avoiding purchasing a phone through this seller as quality control is clearly lacking.
"Apple iPhone 7, 32GB, Black - Fully Unlocked (Renewed)",4.2,9848,R. Riffer,1,Steer clear of this company and phone. Broke 4 days after the 90 day warranty expired.
"Apple iPhone 7, 32GB, Black - Fully Unlocked (Renewed)",4.2,9848,Nicole Dennison,1,It did not come with a memory card or something heart. The battery life is really short on it. And when using it for a while or using it on the charger. The phone gets hot. Really hot. Total waste of money. And I hate the fact that i can't switch over already played games. On certain games. Because they are set up with a gmail account. Not a iCloud account.
"Apple iPhone 7, 32GB, Black - Fully Unlocked (Renewed)",4.2,9848,evelyn nunez,5,Si
"Apple iPhone 7, 32GB, Black - Fully Unlocked (Renewed)",4.2,9848,Shannon Bacon,1,"I bought this phone for Xmas for my daughter. Phone was in good condition, seller shipped it promptly, but overpriced, Communist Apple SUCKS and I hope their corporation tanks. Have a nice day."
"Apple iPhone 7, 32GB, Black - Fully Unlocked (Renewed)",4.2,9848,AlohaMahalo,5,Great deal! My son is happy
"Apple iPhone 7, 32GB, Black - Fully Unlocked (Renewed)",4.2,9848,Asia Morgan,5,I really like how the phone looks in works like new. It got here fast in works great my son really loves his phone. So Thank u very satisfied custumer..
"Apple iPhone 7, 32GB, Black - Fully Unlocked (Renewed)",4.2,9848,Jazz Queen,4,"The phone was very nice looking phone, but I had to return the phone due to it was not compatible with my sprint network service."
"Apple iPhone 7, 32GB, Black - Fully Unlocked (Renewed)",4.2,9848,Sandra Watkins,5,I purchased this phone for my nephew and it‚Äôs practically new. Everything works great. There weren‚Äôt any scratches or anything to the phone nor any issues with adding service to it. I use consumer cellular carrier and it works perfectly! Also a free case with quality screen protector came with it. I will definitely purchase from them again.
"Apple iPhone 7, 32GB, Black - Fully Unlocked (Renewed)",4.2,9848,Franysmendez,5,"Entrega r√°pida, perfecto estado"
"Apple iPhone 7, 32GB, Black - Fully Unlocked (Renewed)",4.2,9848,jenn011711,4,"Was shipped late, but was notified. No issues with the phone."
"Apple iPhone 7, 32GB, Black - Fully Unlocked (Renewed)",4.2,9848,Ivette,5,I bough this phone for my daughter birthday she turn 14 year‚Äôs old and she love‚Äôs her IPhone ‚ù§Ô∏è
"Apple iPhone 7, 32GB, Black - Fully Unlocked (Renewed)",4.2,9848,Katherine,5,Battery dies with in an hr or two and I have to keep it charging constantly
"Apple iPhone 7, 32GB, Black - Fully Unlocked (Renewed)",4.2,9848,Dayvonna,1,It‚Äôs broke
"Apple iPhone 7, 32GB, Black - Fully Unlocked (Renewed)",4.2,9848,Yas Johnson,4,Battery life was terrible
"Apple iPhone 7, 32GB, Black - Fully Unlocked (Renewed)",4.2,9848,Jay,5,Hood
"Apple iPhone 7, 32GB, Black - Fully Unlocked (Renewed)",4.2,9848,Sasha,5,"It‚Äôs a GREAT phone!! I read the reviews and was kind of worried but it turned out great , my carrier lock provider was boost mobile but that‚Äôs a good thing because that‚Äôs my regular provider. The only thing is that it doesn‚Äôt come with a sim card which is no big deal for me. But all in all it‚Äôs a great phone and I am happy with the price because I bought 2 phones for the price of 290 or 300 I believe"
"Apple iPhone 7, 32GB, Black - Fully Unlocked (Renewed)",4.2,9848,Amazon Customer,5,"Always go with the refurbished phones on Amazon. Good value for the money. Nice phone, works well, better camera. I did not like that for it being refurbished that a brand new battery was not installed. It did have 95% life but I think that a new battery should always be part of the refurbishing. It should come with 100% life. Otherwise no complaints"
"Apple iPhone 7, 32GB, Black - Fully Unlocked (Renewed)",4.2,9848,Tony Hensley,2,When you put the phone to your ear to listen you can hardly hear them it‚Äôs real low and it‚Äôs all the way up does that mean it‚Äôs broken probably cuz my case was broken also
"Apple iPhone 7, 32GB, Black - Fully Unlocked (Renewed)",4.2,9848,r3d5,5,"The iPhone 7 I received works well. I tested it fully & installed the latest OS (as of today it is iOS 14.4) and found no problems. Cosmetically it is also in good shape. I think my seller replaced the battery too, because it says ""100%"" capacity in settings. Much to my delight, it also works with Verizon, as I intended to only use it as a wifi tablet (I love computers & devices and wanted a pocket computer that has stereo speakers). I don't know if it works on all other networks, but in the settings it says ""No Sim Restrictions"" so I assume it does. Just be careful when buying any iPhone- message the seller and make sure they confirm it works on your network. That way if it doesn't, you can say you asked before. Note: I'm using the iPhone 7 I got as a tablet, so in the picture I shared it says ""No Sim."" But mine works with Verizon, as I tested it already."
"Apple iPhone 7, 32GB, Black - Fully Unlocked (Renewed)",4.2,9848,Jackie,1,The speaker did not work
"Apple iPhone 7, 32GB, Black - Fully Unlocked (Renewed)",4.2,9848,Sandy lewis,5,Perfect
"Apple iPhone 7, 32GB, Black - Fully Unlocked (Renewed)",4.2,9848,Kaylen Griggs,1,The phone lasted less than 2 months. I will never buy another phone or electronic device from Amazon again
"Apple iPhone 7, 32GB, Black - Fully Unlocked (Renewed)",4.2,9848,Martine,5,Phone is in great condition. Plenty of storage!!
"Apple iPhone 7, 32GB, Black - Fully Unlocked (Renewed)",4.2,9848,Rikayla m Mitchell,5,My flashlight work every single thing work its like i just bought a new phone
"Apple iPhone 7, 32GB, Black - Fully Unlocked (Renewed)",4.2,9848,Laurie in Alaska,5,New phone not a bad price tag
"Apple iPhone 7, 32GB, Black - Fully Unlocked (Renewed)",4.2,9848,Brittany & Sean,4,"Renewed is not new. This phone lasted about 8 months before the charger stopped working right. Bought every charger made and nothing made difference, However it still works just chargers super slow and super picky how it chargers."
"Apple iPhone 7, 32GB, Black - Fully Unlocked (Renewed)",4.2,9848,Stefanie,4,Battery life isn't good. Haven't had for a couple weeks and it's telling us to replace low battery capacity. Other than that very nice phone but iPhone batteries are not cheap to replace. Correction! They made it right!!!
"Apple iPhone 7, 32GB, Black - Fully Unlocked (Renewed)",4.2,9848,Summer,1,"The phone doesn‚Äôt hold a charge and the charger didn‚Äôt work, I tried to contact the seller and they never replied!"
"Apple iPhone 7, 32GB, Black - Fully Unlocked (Renewed)",4.2,9848,Michael,1,Only the home button works. The touch screen is inoperable. Returning the phone for a refund.
"Apple iPhone 7, 32GB, Black - Fully Unlocked (Renewed)",4.2,9848,Christopher Rafter,3,"Ok so LUCKILY I ordered this iPhone for the sake of a quality WiFi device so my issue isn‚Äôt TERRIBLE. Upon receiving the phone and setting it up and using it with flying colors, I discover that the SIM tray was literally glued shut for WHATEVER reason. So, Even if I wanted to activate it as a serviced phone, I couldn‚Äôt. Ultimately, I‚Äôm not mad but I still would have loved to save a 20 dollar bill for the inconvenience... That‚Äôs what happens when you buy a refurbished product online, you hope for the best and expect the worst. It happens from time to time even in face to face transactions."
"Apple iPhone 7, 32GB, Black - Fully Unlocked (Renewed)",4.2,9848,Luisanna Zamora,5,The product is working as expected for an iphone. I purchased the phone for an att prepaid plan for my mother and had no barriers or issues with connection. The quality is great for a Refurbished phone.
"Apple iPhone 7, 32GB, Black - Fully Unlocked (Renewed)",4.2,9848,Loise,1,The phone cannot keep charge.NOT A GOOD ONE
"Apple iPhone 7, 32GB, Black - Fully Unlocked (Renewed)",4.2,9848,Leanthia Lewis,1,After a week with the phone it stopped working after trying to update on itunes. First time buying an iphone from here and it was just a waste of money
"Apple iPhone 7, 32GB, Black - Fully Unlocked (Renewed)",4.2,9848,JenA,5,Thanks! Good price for what I received!
"Apple iPhone 7, 32GB, Black - Fully Unlocked (Renewed)",4.2,9848,Christine Taylor,5,The camera works great.
"Apple iPhone 7, 32GB, Black - Fully Unlocked (Renewed)",4.2,9848,Gloria paz,3,Se recalienta la bater√≠a y se descarga r√°pido
"Apple iPhone 7, 32GB, Black - Fully Unlocked (Renewed)",4.2,9848,Amazon Customer,1,The phone will not charge and its always at 1% and always have to be plugged in. It‚Äôs ridiculous and unsafe for use. I need a refund or a replacement. Plugged in overnight and still no charge greater than1%
"Apple iPhone 7, 32GB, Black - Fully Unlocked (Renewed)",4.2,9848,Matt,5,Battery health was at 85% of original capacity which was well within range. Overall the phone worked great. I‚Äôm very satisfied
"Apple iPhone 7, 32GB, Black - Fully Unlocked (Renewed)",4.2,9848,Iiiiiinny,1,"The screen doesn't work. It's really frustrating to have received this with 0 battery and life and then when I decided to charge and install updates, the screen is completely unresponsive. I don't even know what to do at this point besides refund it. Trust the bad reviews and stay away."
"Apple iPhone 7, 32GB, Black - Fully Unlocked (Renewed)",4.2,9848,alexis,5,Everything came as described and it arrived on time and it works excellent no problems at all my daughter absolutely loves her new phone
"Apple iPhone 7, 32GB, Black - Fully Unlocked (Renewed)",4.2,9848,Carleone,1,"Agreg√≥ la foto para que observen que la bater√≠a est√° en estado para mantenimiento, por lo tanto el celular se descarga en 4 horas o menos."
"Apple iPhone 7, 32GB, Black - Fully Unlocked (Renewed)",4.2,9848,ashley,5,My phone was fully unlocked as promised. Everything works great in the phone . No problems what so ever. Everything on the phone works like a brand new one. I go through Appalachian wireless. Which is the cdma network and my SIM card worked perfectly. I would recommend buying this phone from this seller to anyone. NOTE:(not all phones sold on Amazon are from the same seller).
"Apple iPhone 7, 32GB, Black - Fully Unlocked (Renewed)",4.2,9848,Candace,5,Not many businesses out there actually beat Amazon delivery speeds but oh this one did! My daughter lost her phone and we were trying to get one here before the weekend and Avant came through and a day early I might add. The phone is in perfect condition battery is charging without problems and holds a charge. No defects or imperfections or anything. The charger is new and works.
"Apple iPhone 7, 32GB, Black - Fully Unlocked (Renewed)",4.2,9848,Phil,3,It's ok
"Apple iPhone 7, 32GB, Black - Fully Unlocked (Renewed)",4.2,9848,Kevin b.,2,Gets hot quick
"Apple iPhone 7, 32GB, Black - Fully Unlocked (Renewed)",4.2,9848,Betania,5,Muy buena
"Apple iPhone 7, 32GB, Black - Fully Unlocked (Renewed)",4.2,9848,shyla,1,"DO NOT BUY THIS ‚Äúrenewed‚Äù phone. It has a known antenna issue. If it is working for you, beware that you might be one iOS update away from owning a BRICK! My family got this for me for Father‚Äôs Day and it bricked at iOS 14.1. Went into a constant ‚Äúverifying update‚Äù. When I did a hard reset, a message- can‚Äôt connect to carrier came up....too many issues. Took it to Apple and they very kindly agreed to try to fix the known issue but warned me the phone may have after market parts that might preclude them from the repair....we will see in 10 days. Either way...Dont Do It! Or...spend some extra on extended warranty if it‚Äôs available. This phone WILL fail."
"Apple iPhone 7, 32GB, Black - Fully Unlocked (Renewed)",4.2,9848,Robert D Evans,1,"Customer service, puts the burden on you, when they sold you a defective product."
"Apple iPhone 7, 32GB, Black - Fully Unlocked (Renewed)",4.2,9848,Bryce T.,1,My son saved his money up to get this phone and only 1 year later the phone is now a brick and apple will do nothing without paying 359.00 to fix the manufacturing defect that these sellers phones seem to have.
"Apple iPhone 7, 32GB, Black - Fully Unlocked (Renewed)",4.2,9848,Amazon Customer,1,battery health came way below at 76% it was advertised as 80%
"Apple iPhone 7, 32GB, Black - Fully Unlocked (Renewed)",4.2,9848,Marie Anatacha,5,Wow üîü out of üîü
"Apple iPhone 7, 32GB, Black - Fully Unlocked (Renewed)",4.2,9848,ReNita J,1,Phone does not ring at all.
"Apple iPhone 7, 32GB, Black - Fully Unlocked (Renewed)",4.2,9848,James Gil,5,"The iphone looks like new, amazing. The life's battery was 78% so, thats not good but its ok."
"Apple iPhone 7, 32GB, Black - Fully Unlocked (Renewed)",4.2,9848,J l Wagner,5,Bought this for my husband who is going to be 80. His hearing aides would only work with the Iphones. We are so happy we choose this phone. You will not be sorry in this purchase.
"Apple iPhone 7, 32GB, Black - Fully Unlocked (Renewed)",4.2,9848,Kuilani,5,Battery life lasts an hour. But was well packaged and arrived on time.
"Apple iPhone 7, 32GB, Black - Fully Unlocked (Renewed)",4.2,9848,Jaelen,1,"I bought this for my girlfriend awhile ago and the touch screen didn't work. We tried restarting the phone to no avail. Please do not waste your money this phone, it does not work."
"Apple iPhone 7, 32GB, Black - Fully Unlocked (Renewed)",4.2,9848,Joy Holden,5,Love it
"Apple iPhone 7, 32GB, Black - Fully Unlocked (Renewed)",4.2,9848,Serge Tkach,5,AS ADVERTISED!
"Apple iPhone 7, 32GB, Black - Fully Unlocked (Renewed)",4.2,9848,Richard Howard,5,Great phone for my daughter
"Apple iPhone 7, 32GB, Black - Fully Unlocked (Renewed)",4.2,9848,Amazon Customer,1,This phone would say it was changed at 100% and soon as you took it off the charger the phone would die. Did not hold charge and some random button was on the screen and there was no way of getting rid of it. If I could give this item zero stars that‚Äôs what it would have got. Seller on the other hand responded quickly and was very understanding.
"Apple iPhone 7, 32GB, Black - Fully Unlocked (Renewed)",4.2,9848,Liz,5,Good color condition as in the picture
"Apple iPhone 7, 32GB, Black - Fully Unlocked (Renewed)",4.2,9848,Jfry1,5,Got here 2 days early overall so far I am happy with this present I bought for lil bro.
"Apple iPhone 7, 32GB, Black - Fully Unlocked (Renewed)",4.2,9848,Julie Coates,5,"Nice phone, was refurbished but in great condition"
"Apple iPhone 7, 32GB, Black - Fully Unlocked (Renewed)",4.2,9848,Odysseus Quinones,5,Good camera quality and storage great for my lil sister
"Apple iPhone 7, 32GB, Black - Fully Unlocked (Renewed)",4.2,9848,Kaykay,1,The battery health was very low
"Apple iPhone 7, 32GB, Black - Fully Unlocked (Renewed)",4.2,9848,alex,1,This is a useless phone now thanks to ios
"Apple iPhone 7, 32GB, Black - Fully Unlocked (Renewed)",4.2,9848,Joy David Barman,1,Damage and break at cam side backside.
"Apple iPhone 7, 32GB, Black - Fully Unlocked (Renewed)",4.2,9848,Melissa Mincer,1,The phone does not work properly it heats up so hot every time we try and use it .
"Apple iPhone 7, 32GB, Black - Fully Unlocked (Renewed)",4.2,9848,holly drew,1,This phone worked for two weeks have been asking for a return and have even been replied to.
"Apple iPhone 7, 32GB, Black - Fully Unlocked (Renewed)",4.2,9848,susan,5,The speaker was bad
